{
  "contentIdentitySha256": "c6db09d4bc7a7340a99d884e89ddb2e69647fc2270176bb95c8945d64bbefc53",
  "kind": "genesis/canonical-example-suite-v0.1",
  "pairs": [
    {
      "capabilities": [],
      "concepts": [
        "contracts"
      ],
      "id": "contracts",
      "invalid": {
        "expectedOutcome": "sealed-rejection",
        "files": [
          {
            "path": "main.gc",
            "sha256": "d1bbcacb8d7b8b866ed0c11ccfc13b5f0fc1707fc455fd1cccf7f535559a2eb9"
          }
        ],
        "root": "examples/canonical_language/v0.1/pairs/contracts/invalid",
        "steps": [
          {
            "argv": [
              "--json",
              "eval",
              "main.gc"
            ],
            "expect": {
              "assertions": [
                {
                  "operator": "contains",
                  "pointer": "/data/value",
                  "value": "unhandled (msg canonical/contracts::missing nil)"
                }
              ],
              "exitCode": 0,
              "kind": "genesis/eval-v0.2",
              "ok": true
            },
            "id": "execute"
          }
        ]
      },
      "lesson": "Contract dispatch accepts declared operations and returns an unforgeable UNHANDLED value for unknown messages.",
      "mutation": {
        "after": "canonical/contracts::missing)) nil",
        "before": "canonical/contracts::ok)) nil",
        "kind": "replace-once",
        "path": "main.gc"
      },
      "repair": "Restore the message operation to canonical/contracts::ok; do not add a catch-all contract branch.",
      "valid": {
        "expectedOutcome": "accepted",
        "files": [
          {
            "path": "main.gc",
            "sha256": "5f27ebca04407bc97d3dd3f29bafcb5e3aeb00fb80cc387f9e4eb65166eb2b4f"
          }
        ],
        "root": "examples/canonical_language/v0.1/pairs/contracts/valid",
        "steps": [
          {
            "argv": [
              "--json",
              "eval",
              "main.gc"
            ],
            "expect": {
              "assertions": [
                {
                  "operator": "equals",
                  "pointer": "/data/value",
                  "value": "42"
                }
              ],
              "exitCode": 0,
              "kind": "genesis/eval-v0.2",
              "ok": true
            },
            "id": "execute"
          }
        ]
      }
    },
    {
      "capabilities": [
        "io/fs::read"
      ],
      "concepts": [
        "effects"
      ],
      "id": "effects",
      "invalid": {
        "expectedOutcome": "capability-denial",
        "files": [
          {
            "path": "caps.toml",
            "sha256": "e751eec7013b20311108e97441b4d83ddb3aacb3edf96d905edf481f52a42b14"
          },
          {
            "path": "data.txt",
            "sha256": "e7045a66512bec1e9f535a51ba79bcad828d87ce668de9c8f86aa7e02de29318"
          },
          {
            "path": "program.gc",
            "sha256": "c0ba5199dee3ca5324f6cecde4eb0639d8c9bcbe9290e5e5fc6770eea0d26754"
          }
        ],
        "root": "examples/canonical_language/v0.1/pairs/effects/invalid",
        "steps": [
          {
            "argv": [
              "--json",
              "run",
              "program.gc",
              "--caps",
              "caps.toml",
              "--log",
              "effect.gclog"
            ],
            "expect": {
              "assertions": [
                {
                  "operator": "equals",
                  "pointer": "/data/denied",
                  "value": true
                },
                {
                  "operator": "equals",
                  "pointer": "/diagnostics/0/id",
                  "value": "genesis/diagnostic/v1/caps/denied"
                },
                {
                  "operator": "equals",
                  "pointer": "/error/code",
                  "value": "caps/denied"
                }
              ],
              "exitCode": 41,
              "kind": "genesis/run-v0.2",
              "ok": false
            },
            "id": "execute"
          }
        ]
      },
      "lesson": "Filesystem effects require an explicit least-authority capability and emit a deterministic effect log.",
      "mutation": {
        "after": "allow = []\n",
        "before": "allow = [\"io/fs::read\"]\n\n[op.\"io/fs::read\"]\nbase_dir = \".\"\n",
        "kind": "replace-once",
        "path": "caps.toml"
      },
      "repair": "Restore the reviewed io/fs::read capability entry rather than broadening the policy beyond this operation.",
      "valid": {
        "expectedOutcome": "accepted",
        "files": [
          {
            "path": "caps.toml",
            "sha256": "88ac82f9db453d69cce5ea6160ee4233a0539dba729fa099f54430974f7fa206"
          },
          {
            "path": "data.txt",
            "sha256": "e7045a66512bec1e9f535a51ba79bcad828d87ce668de9c8f86aa7e02de29318"
          },
          {
            "path": "program.gc",
            "sha256": "c0ba5199dee3ca5324f6cecde4eb0639d8c9bcbe9290e5e5fc6770eea0d26754"
          }
        ],
        "root": "examples/canonical_language/v0.1/pairs/effects/valid",
        "steps": [
          {
            "argv": [
              "--json",
              "run",
              "program.gc",
              "--caps",
              "caps.toml",
              "--log",
              "effect.gclog"
            ],
            "expect": {
              "assertions": [
                {
                  "operator": "equals",
                  "pointer": "/data/denied",
                  "value": false
                },
                {
                  "operator": "equals",
                  "pointer": "/data/value",
                  "value": "22"
                }
              ],
              "exitCode": 0,
              "kind": "genesis/run-v0.2",
              "ok": true
            },
            "id": "execute"
          }
        ]
      }
    },
    {
      "capabilities": [],
      "concepts": [
        "modules"
      ],
      "id": "modules",
      "invalid": {
        "expectedOutcome": "diagnostic-rejection",
        "files": [
          {
            "path": "app.gc",
            "sha256": "12923c265baf037543195f3bf62183933287566edbf53e13c0336e7ee09b1cd9"
          },
          {
            "path": "math.gc",
            "sha256": "6109160345c108cd0185e07baa94c3fc294f3afa831d8c0d22a4d7dcd477d7c9"
          },
          {
            "path": "package.toml",
            "sha256": "8210cdab380f2b2910a8220a941c67177c9b7eb1b6397807d483ffd8ce5ca3c0"
          }
        ],
        "root": "examples/canonical_language/v0.1/pairs/modules/invalid",
        "steps": [
          {
            "argv": [
              "--json",
              "typecheck",
              "--pkg",
              "package.toml"
            ],
            "expect": {
              "assertions": [
                {
                  "operator": "equals",
                  "pointer": "/diagnostics/0/id",
                  "value": "genesis/diagnostic/v1/io/error"
                },
                {
                  "operator": "equals",
                  "pointer": "/error/code",
                  "value": "io/error"
                }
              ],
              "exitCode": 70,
              "kind": "genesis/error-v0.2",
              "ok": false
            },
            "id": "execute"
          }
        ]
      },
      "lesson": "Every package module path is base-relative, content declared, and checked as part of one module graph.",
      "mutation": {
        "after": "path = \"missing.gc\"",
        "before": "path = \"app.gc\"",
        "kind": "replace-once",
        "path": "package.toml"
      },
      "repair": "Restore the declared app.gc module path; do not use an absolute or host-dependent replacement path.",
      "valid": {
        "expectedOutcome": "accepted",
        "files": [
          {
            "path": "app.gc",
            "sha256": "12923c265baf037543195f3bf62183933287566edbf53e13c0336e7ee09b1cd9"
          },
          {
            "path": "math.gc",
            "sha256": "6109160345c108cd0185e07baa94c3fc294f3afa831d8c0d22a4d7dcd477d7c9"
          },
          {
            "path": "package.toml",
            "sha256": "8b88d89fc7c934a1ca41e0fb0280a4ba83b301cfa911639bd59c84a3e7a36e00"
          }
        ],
        "root": "examples/canonical_language/v0.1/pairs/modules/valid",
        "steps": [
          {
            "argv": [
              "--json",
              "typecheck",
              "--pkg",
              "package.toml"
            ],
            "expect": {
              "assertions": [
                {
                  "operator": "equals",
                  "pointer": "/data/strict_sound",
                  "value": false
                }
              ],
              "exitCode": 0,
              "kind": "genesis/typecheck-v0.2",
              "ok": true
            },
            "id": "execute"
          }
        ]
      }
    },
    {
      "capabilities": [],
      "concepts": [
        "packages"
      ],
      "id": "packages",
      "invalid": {
        "expectedOutcome": "diagnostic-rejection",
        "files": [
          {
            "path": "case.toml",
            "sha256": "79bebc57c5fe7d756f3abbdd7941507f862a0ccf01e6fd21330d6079671bb817"
          },
          {
            "path": "main.gc",
            "sha256": "87c7b7858d255114ab6bc4dbe85cb7e9b47a5f0ae086c62dda04479a8086ea53"
          }
        ],
        "root": "examples/canonical_language/v0.1/pairs/packages/invalid",
        "steps": [
          {
            "argv": [
              "--json",
              "typecheck",
              "--pkg",
              "case.toml"
            ],
            "expect": {
              "assertions": [
                {
                  "operator": "equals",